{
  "record_id": "sample-remove-me",
  "platform": "web",
  "author_id": null,
  "author_name": null,
  "author_url": null,
  "content_id": null,
  "content_url": "https://example.com",
  "title": "sample",
  "text": null,
  "transcript": null,
  "ocr_text": null,
  "published_at": null,
  "collected_at": "2026-09-28T13:08:14.076Z",
  "media_type": "article",
  "metrics": {},
  "collection_method": "manual_sample",
  "raw_path": null,
  "dedupe_key": "web:example.com",
  "project_relevance": "unknown",
  "has_product_or_service": "unknown",
  "has_case_or_result": "unknown",
  "has_reproducible_process": "unknown",
  "commercial_activity_type": [],
  "evidence_level": "unknown",
  "ai_score": null,
  "ai_reason": null,
  "review_status": "pending"
}